,content,uuid
44129,Implementing and Securing an API with ASP.NET Core,c6807796a8bd4f7c9c3308b5c8d85614
44130,Implementing an API in ASP.NET Web API,29a8f0af3a55484abe4c1810c2ff32d0
44131,Entity Framework and Data Models,0a061dda28ba4944b9fec0dd1d2b8a83
44132,Web API v2 Security,2a1f59b1f3134ce8acbf96c2ec3ac670
44168,Whatâ€™s New in CentOS 8,b35848228f794b9593566502d0ef2aad
44202,Enhancing the Android Application Experience,15704a8345ec48b6a7fc611e8680e459
44251,Spring Integration: Getting Started,c9da03d28fd94f44b75ace01a2aec141
44264,Introduction to Inverted Triangle CSS,1a37bff32ddb446194e297f50a88ab29
44299,Play by Play: Machine Learning Exposed,dbd96ffb0d194b658e41d042b86fe6f3
44311,Understanding ASP.NET Core Security,58fafaff3ee74444b4d2ee06af93e837
44314,Functional Programming with C#,d572118f7a774b17b8e1c8b37161e6f5
44315,Securing ASP.NET Core 2 with OAuth2 and OpenID Connect,7dfdafc9f9ae456d9c26004a9216b989
44316,Configuring Security Headers in ASP.NET and ASP.NET Core Applications,e0f75462594140669d80461edc54f16a
44318,C# Interfaces,5ccf05cd1fe944c6907a1d1ff5197eae
44320,Understanding ASP.NET Core 3.x,604d94fd5f7247b3bb160427509a9e76
44323,Getting Started with Dependency Injection in .NET,31a99b89eb98465ca122aa4ae6d4d0ff
44436,USB Forensics: Writeblocking and Impersonation,5e151cf870a84cbf88e6626ca12a13fd
44505,Introduction to Houdini Digital Assets,670961d277134e719b2e7db9c2b7d95d
44515,ASP.NET Identity 2 Fundamentals,808bd57be98d433d88ec8cdf571dab88
44516,Dates and Times in .NET,977a39bfc3154134bd3177b0472304a2
44518,Refactoring for C# Developers,3d76eb6c64154c97a6d8117fd5fec06c
44519,Using OAuth to Secure Your ASP.NET API,16257f6c5e5e4861b2871c9648062417
44521,Refactoring Fundamentals,2d9277b71ef74b4ea4e5e6c088cb81c4
44537,Play by Play: Modernizing C++ Code with Kate Gregory,00f951896a8c4b4dada40b6f59edc3ed
44544,Fusion 360 Essentials - Patterns and Symmetry,b7124e77c55746e19afaaaf53fa19bc9
44548,Test-Driven Development Practices in Java,19afdfeecd05413aa268ee58e3640009
44566,Hardcore Functional Programming in JavaScript,c59508d4c2904911912725989c4682c6
44676,Building and Troubleshooting a Network with ICND1 Skills for Cisco CCNA 200-125/100-105,7816a864d3ff427eb3c645858ea8a7e4
44723,ASP.NET Core Identity Deep Dive,5f79513e085246f897a06bf78bd22b32
44732,ASP.NET Authentication: The Big Picture,c6c041e6c3b140208160d98807a0cb68
44789,AWS Developer: Deployment and Security,745e4cd553c845009b6a438978d3ccf4
44798,Cultivate Your Personal Strengths Using Gallup Tools,79ffd2d642c8431cb938109ccaaf75bd
44801,Developing Unified Asset Systems in Illustrator,6ceb45b88fd04f3881729fc070ff0ed8
44817,Node.js Testing Strategies,9db8ac561e6548508379de272f3bb941
44831,AWS Security Operations: Securing Core AWS Infrastructure Services,f616e5c11cbf49938f8d1445441bcf25
44844,Learn to Think Like a Hacker,2efef97577d641c79ccd19bdeb16bbfb
44901,Introduction to EMC VPLEX,bc1d88ddaab64196b9ce033b5eeb6150
44939,The Database Is Only Half Done,2c920c69a1fb45089baee31ec89b1027
44947,EF Core 1.0: First Look,7a6a06756bc94add822f0432acf578c8
44965,Windows PowerShell Remoting Fundamentals,9d9796bc970a4c119fae5705e79d6a43
45092,Citrix XenDesktop 7.15 LTSR: Machine Creation Services,1faf13d1fb4a44cea7d522b25048021f
45093,"Citrix XenDesktop 7.15 LTSR: StoreFront, Receiver, and NetScaler Gateway",97e278cbf69241d08aecbb6d2212f850
45094,Drive Business Growth While Satisfying GDPR and CCPA,f0f62e28ed9344b19a4b953f35e45c03
45096,Top 10 Privacy Tips & Tricks in Big Data,51b061bd8bbd4f61aa2fcb8ba8ef6ba0
45171,Entity Framework 4.1 - DbContext Data Access,bf5a2aa77c994923bf57821ac7627a00
45172,Cross-platform SQL Server Management for Developers Using VS Code,e4e212c0158b4c7d85f2487fbdcd07f9
45178,Entity Framework in the Enterprise,ae0a4ab1a1964c2d8f19f2d2de86087f
45183,Entity Framework 4.0 By Example,ef66bdff299d4214997ac5acd6595e0e
45186,Play by Play: Converting Synchronous Calls to Asynchronous in ASP.NET Core and Entity Framework Core,5f6bd1089f9a4548ba3a10ffb3855c6f
45187,Entity Framework 4.1 - Code First,49a417803e1545be8eac215d591fed35
45188,Getting Started with Entity Framework 5,bb8c3b38d7104dd5bc8df86bcd6db6a8
45191,Advanced Entity Framework 6: The Ninja Features,1d3a31f25707488b8fbb4330a9b188db
45226,Optimizing a Data Warehouse on the Microsoft SQL Server Platform,e77278b87e944876b58f9ef2687f9d51
45256,A Practical Guide to Vanilla Web Components,0c7be766aa904676b354d1dac191dcc2
45265,AWS Security Fundamentals,4f156eb4b844485ca229690a48aa867b
45335,Network Address Translation (NAT) for Cisco CCNA 200-125/100-105,2dc3669630984a2ab5dfac5bd80b57ef
45399,Making Your C# Code More Functional,11a235a7a14844ee90708527f46c9b32
45435,Linux Managing DNS Servers (LPIC-2),e2cc7c715d0c45dd93e6552be88aea83
45484,Operationalizing Bash and Z Shell Scripts,a84f151a0caf43f6b59bd9b5174d5de2
45488,Fileless Malware,bcea589db5564505b9b08407b9cc88ca
45501,Design for e-Commerce in a Mobile-first World,8083e026eff849ccaaa881c326615b76
45512,Understanding the Java Virtual Machine: Security,91d0d3b112bf4691ad8207e287c1b832
45513,Creating a Low-poly Game Building in Maya,e2fdf9bb5a894b99874a721e9b7cc5cb
45514,"Maya 2019 Fundamentals: Dynamics, Lighting and Rendering",448c1596a3e649d2bced6fe6bee9fad2
45518,Hands On Responsive Web Design,81a21f22a58946a6b49316b4ed33c8a5
45530,Access Control Lists (ACLs) for Cisco CCNA 200-125/100-105,87502fe5a45742a4b557be764f8b72c4
45538,Getting Started with UI Testing and Appium,f8f97da66fdb4d78b0770cb297afc45a
45539,Getting Started with Web API Test Automation in Java,302e96d19e8446f8933d73529b6fa137
45552,Securing Your API Endpoints: CodeMash,f76cd3fe8a6b47c0907946fc8ba92c7c
45580,C# Best Practices: Collections and Generics,fede280ebc0b4dd09d9b7feba0ca4352
45624,Angular and the Case for RxJS: CodeMash,bb41ea43987f456eb84aab447e9e12d8
45671,Managing Cloud Resources Using Google Stackdriver,27c60282e6214b5a98e2ee9dfe58b725
45674,Architecting Google Cloud Storage Configurations,9f8a3d1942fb44e5868be963bf9d8c6b
45675,Migrating to GCP,630885a6708f4cf5b160f8685195c503
45695,Automating the Web Using PhantomJS and CasperJS,516f5a4a074442e6badf5989bc1ffb63
45749,Network Access and Authentication,ca0400ec81e34705a0370b338b15a45c
45762,Cisco CCNA Security: Firewalls and VPNs,34b2e13905f64c629b5b831702befa7b
45771,Identifying Security Requirements of an AI Solution,5d8e083ef3304c85ba12815fc9bfc55f
45773,Securing and Integrating Components of your Application on Google Cloud,35118252d5eb4c7c809b7879a65a1c47
45821,Jira Workflow Creation and Customization,1a156f3a9b734e238795a60895954417
45834,Premiere Elements Fundamentals,e05e0d6024324feb9c3b8ffce3b2785f
45864,AngularJS Material Fundamentals,96cb95c861e94345a22caccf5c0bd2cd
45866,ng-conf '19: Blast Off with Angular Material,47403d7c7f1843deb71f0fc72a2d2a89
45890,PHP: Get Started,05e1ca176e864c25a43b075ae3b40ecd
45920,Application Layer Protocols for Cisco CCNA 200-125/100-105,bce66ee06b594b57b3c37ce63d082c9b
45950,Designing Data Pipelines with TensorFlow 2.0,b6b1cc6a9a9c4408a18c70f1380b487f
45976,A Functional Architecture with F#,be6f6a3bcd3540358e6a24df95434db8
45977,F# Jumpstart,1e08758f222447cea54db58412fbf777
45978,F# Fundamentals,1bf8f6c357034feb94a253060235c63a
45979,Writing Purely Functional Code in C#,ec76cb5527e34d6b85aeaf261ab43ac7
45980,Unit Testing with F#,28cd904a08a04e2491d9c21d91158421
45982,Using Visual Studio Code for ASP.NET Core Projects,335774f9c8db4c3786eb68ca5aea75eb
46006,Identity and Access Management on AWS: Designing and Implementing an AWS Organization,8218b6151b9648738341000ea3e77705
46007,Build Your First Data Visualization with Bokeh,d1dd6f84942e4f11a51cb0cb60b36329
46011,Firebase on Android: User Email Authentication and Verification,03a17cb4c4964cdd929dea7dd73292e1
46012,The Anatomy of Email Design in HTML,3d084fe31038444299f217f68f39e9ad
46029,Introduction to Cisco Network Design for CCDA DESGN (200-310),e3cf8aec06c347d097be562c57cfd8ce
46105,Final Cut Pro X Fundamentals,1d8a9351ad19481c9a36c5b72c1fa436
46258,Apache Ant Fundamentals,8a9898977ab64cafbaf7e6270b64b40c
46289,Play by Play: Understanding API Functionality Through Swagger,c4b233524af9482c905f4ac15f9ea057
46296,Advanced Color Grading in Adobe SpeedGrade CC and Premiere Pro CC,bccdbf3290e342908fee468f5390d769
46330,Four Semesters of Computer Science in 5 Hours,ba5153beb4c644978abb6f3b069285b0
46336,TCP and UDP Operation for Cisco CCNA 200-125/100-105,02c7c0be9376426c96497ff7dffd593b
46441,Using gRPC in ASP.NET Core,a375a7eaadd14b16be14310cda180a6f
46465,End-to-end Software Development with Team Foundation Server 2015,dd5d92ff230348d5b1c349f0d77db2cb
46541,Real-Time Web with Node.js,457f42d0ea004b0bbd4f70c7b4e1a927
46557,Building a Better Business Case â€“ Building a Better Business,fd895800498a4329a628d01646877025
46637,Backbone.JS In-Depth and Intro to Testing with Mocha and Sinon,f2ff929fd16546ecb4aa0d41754ae3e3
46654,Level up Your Extension Game,c6d00f8b30ed46d099bb58ffcb0f8f81
46656,Creating a Blog with Ghost,7e71f84510dd456eb0434966271f418d
46693,Fiddler,d9eecff98f8946718326425fc6581112
46711,Adobe CC Color Grading Tips,e8c719a2285a44be87918095ec395fc3
46781,Android Fundamentals: Activities,a80670e8cf504ea089b54cb7c75e4b88
46782,Android Fundamentals: Fragments,d08ba420dc544e2a9ec5bf60c50c32e3
46784,Choosing and Implementing Google Cloud Compute Engine Solutions,295d0234d0744453941ac88ab8e4a17d
46791,Getting Started With Elasticsearch for .NET Developers,f353386af7f5425fbc9b7d599eb6f4ec
46823,Introduction To Hibernate,ea47e39cb5034661b9489bb861898e62
46837,Fundamentals of Building Office Add-ins with Office JavaScript APIs,fa207daaefac475da165e5657b09e22d
46888,How Google Does Machine Learning,884bc50ab32e4de1b3dd40062aac02f5
46970,Securing the Switch for Cisco CCNA 200-125/100-105,d30ef2e59154457888f72648089b878d
47064,"Droidcon Boston '19: Flutter, a Designer and a Developer Walk into a Project",552c0e3467b54fcf8b2fc461f56eb16b
47078,"Balancing Performance, Scalability, and High Availability in Your Database Environment",efdea390a79f4b478b88ef26b428ef95
47092,Configuring CORS in ASP.NET and ASP.NET Core,461b9d9006224f43b896e9e30ee0acb1
47134,Qt Quick Fundamentals,70c912002961422b971ed436c8589523
47201,Integration Services Fundamentals,79695b67fb13406cbe539d59162701bc
47203,Creating a Style Guide with Sketch,0c5ead20f3644d809fb11b36eeb82b51
47222,Advanced Redux,2a013a4752fc4015a2540d28f0127929
47311,"Taking Your App to the Next Level with Monitoring, Performance, and Scaling",fa68a9056ec842dbbcf98a59cd8e84e9
47395,Wireshark Core Protocol Analysis,9fecb83df3b14c9092ee532d7d5220ce
47462,Cisco CCNP ROUTE: BGP,b52e6fe22f8141d69287a394e7f678e9
47486,MVVM Light Toolkit Fundamentals,ad150de94db24c18a11ecaeafa0a1775
47493,Getting Started with BeEF,cb4482b4a4584b8cae632166c70cae36
47512,Reactive Programming with RxAndroid and Kotlin,edb37b4368114d888679ccc36672702c
47517,Usability Starts with Accessibility: CodeMash,da8a18e711044dea90d929cebe365194
47534,Optimizing SQL Server Statistics and Indexes,4378e5b25fd64263a892bf01f1a7da38
47589,Fundamentals of Written Proposals,61736c7953b2434583dc487269bf6704
47590,Applying Business Analysis Techniques in Agile Environments,8f115edd890b43bcbe02c1a9a0645c47
47618,Building Windows PowerShell GUIs in WPF for Free,371e9166f643487fa2f32ded341decbd
47622,Managing Certificates with AWS Certificate Manager,9a8394b840f740ed851a182101616c76
47641,Tidyverse: R Playbook,21f557eed51d4c26a5f53f7fdd5b75eb
47642,Building Your First R Analytics Solution,f2b765380a1c4e9383180fc2325ef822
47643,Creating Visualizations in R Using ggplot2: R Playbook,997b10f6fa3e444aa994ca0875c3f152
47652,Implementing Custom Middleware Components in ASP.NET Core,afb6529eaf3d4ad88ad003e74bd4be70
47678,WordPress Custom Theme Development,e69b211a8c1a47b6930681342f974c2d
47699,Building Components with Angular 1.5,65fb7f541e5b4b929ef34655b6c86cf3
47733,Understanding ASP.NET Core,9457570af9d245d2aad5fb8a10f7ff40
47753,Implementing Web and Mobile Services on Microsoft Azure,86816ebd1cbc43828c563488dc44be15
47825,Building Ruby Gems,ce2dc93693654a2cbb24049e1647e6c9
47882,Implement SSL Offload for Citrix ADC,4a4e5b9040e847a39889e999a1b8fa32
47884,JavaScript From Scratch,0eac3b0ce2784b5a92b9c205a5770c73
47935,.NET Internals and Advanced Debugging Techniques,2c190d397e76441a89681912c24a1023
48008,ng-conf '19: Crash Course: Angular and ngRx,554c95f0003646149a690a34e7532723
48030,Power BI Playbook: Securing Shared Data with Power BI,36e08358bd8e4e7baf5bc0fc3e6215a6
48045,Android Fundamentals: Accessibility,9a14a2a689094c9da455a94a2b9d93c8
48074,Premiere Pro CC Building on the Fundamentals,d96657b6160043eb9ede608ac36acb31
48112,How to Stop Man-in-the-Middle and Downgrade Attacks in Your Apps,267f4e4430024ff886a19830b7db6ed6
48128,"Enterprise AI Scenarios for Speech, Technical Edition",5b073a433f884e3ea7e4a608ce69fc0b
48162,Building Image Processing Applications Using scikit-image,b0c93ec0cf6a4e03b0be79cb301679cd
48163,Building Blockchains with Hyperledger,db4fa4e632774fd9a8a0d392093a87c5
48208,Hacking VS Code: Write Your First Extension for Visual Studio Code,9ec8ee390dc343c293c7252b01c3fa50
48292,Play by Play: Problem Solving in a Developer World,f950bb9a865c43058f792675e9bd94a7
48315,Monitoring & Security for CCNP Routing and Switching 300-101 ROUTE,0d17d5691f25469394eadba89f2140fa
48414,Implementing Microsoft Azure Networking,839e5fe9737a45b3a8ab3886e79c3cd2
48467,Programming R Vectors and Factors,bda9fd7522cb4207a40f6c63aa4fc16b
48468,Visualizing Data in ggplot 2: R Data Playbook ,3f0baaa8d49842f0a094b70ae9cbe229
48469,Multivariate Data Visualization with R,6fca3cd80ba0431480f572a492ff2148
48557,Building a RESTful API with ASP.NET Core,2d1eef32465c457b92fb489a6b7e0176
48570,ASP.NET Core and ASP.NET Input Validation,098a8b654e664dd3a36e8516d60dc25a
48619,AWS Developer: Getting Started with DynamoDB,f153410a6dee45adbb45cee464c932d7
48625,Automating AWS with CloudFormation,782c8411477e4fcda1c139924b850eb3
48679,How to Win Friends and Influence Better Developer Estimates,a12cae0808024fc7897e9fc1cb6cfc13
48694,Networking in GCP - Hybrid Connectivity and Network Management,ed0714a540864d999d9694b36b4d82f8
48756,Getting Started with Laravel (PHP Framework) - Users and Authentication,420c421aa064430cbe0374be2705d02a
48775,Let's Build a Dependency Injection Framework [Live Coding],b2d8cb6cc0fe459d82d7ffe5b63c8b17
48777,Cross Site Request Forgery (CSRF) Prevention for ASP.NET Core and ASP.NET Applications,2c97533a36d245758e5b6c4f53f71618
48812,Deploying Basic Infrastructure Services on AWS,63c6a9d715e147eea0cd2f8938ecaa15
48850,API Development on Google Cloud's Apigee API Platform,3b0f7d0012db4984afd3762ae5b9874f
48860,Configuring Cisco TelePresence Conferences,5d78fe626f5a4c249731e59545cf2e3c
48861,Deploying Cisco Enterprise Voicemail with Unity Express and MediaSense Server,c0a17ef59f0f4b6fb0240f7477b1d38e
48878,Creative Perspective Techniques for Artists in Photoshop CC,2bdc2d69934f4d9c85ca6d55a4fd6398
48896,Maya 2019 Fundamentals: Overview and Modeling,71e109dba6a7486085cab4a2e0dd1469
48931,Google Cloud Fundamentals for Azure Professionals,0e277dfb55304df5b1dba7381f695190
49045,Setting Expectations on Data Science Projects,52c9c4d308594356b49d4ae708f77bb7
49060,Secure Coding: Preventing Insufficient Logging and Monitoring,1dbec21b549d4ffdaee3ab6be6965695
49077,Understanding and Applying Logistic Regression,810218e17e544b13879ac5509f5d17a0
49251,Leveraging Advanced Features on the Google Cloud Kubernetes Engine ,e2d4186a35d14a95bceaac75b4f126cf
49257,Enterprise Patterns: Concurrency in Business Applications,755a683581394d07b7858cd5a8d2d912
49287,Your Strengths Include: Work/Life Balance,697b55d118dc4d158c97646f6694ee4b
49316,HTTP Networking in iOS,85497255c79240deb545962a7cc8b527
49317,Troubleshooting ACLs with Wireshark,6e19b271faec456ebcf7a4a0003c5c7a
49319,Web Application Penetration Testing: Input Validation,126342ebf28c497a944ddda22e8e04fb
49333,GitHub for Windows Developers,f177189e25a849d7b70edc5b991f39b0
49379,Juniper Networks JNCIA-Junos (JN0-102): Junos Operating System Fundamentals,195b7504482f4a2ba04649b5e7eab266
49380,Juniper Networks JNCIA-Junos (JN0-102): Routing Fundamentals,49a9b7fa878843029f63c310645f4bea
49412,Access Your Own Low Cost SAP Development System,3a6f37c425e946a3b4bccf6778ee5fa0
49414,Accessibility: Exploring Images and Media,ca58cafe9ae44ab584c0daa96d470430
49478,PHP: Getting Started,42a8d5efbe7a4b4f81910923634e4001
49518,Build Your Career with Michael Lopp,ee0d640b5cfd4efca869844eeeb81e7a
49519,Building and Managing Your Career Plan,12cb8f725c4c44f9add37f40752c9840
49561,IT Governance Implementation Foundations,c5acead943a742eda2ed26651842b80c
49563,HTML5 Canvas Fundamentals,f7a788f09a9945718802be0a4ee5f961
49606,Connecting IoT Devices and AWS with Amazon Greengrass,826941a493a84fff934ee5673c856845
49610,Android Unit Testing with JUnit and Mockito Using Kotlin,119ff17ad98a4cf18dfdd935e9557867
49667,Lighting Your Illustration with Blending Modes in Photoshop,25e177047d0f4e4f98ca48210bcc8339
49776,Introduction to Building Website Layouts,a31ef61db10a47689123246081882e33
49815,Adobe Photoshop Fix Fundamentals,6281cd05098048b7b150c4356dfe656b
49816,Provisioning and Managing AWS Storage Gateway,f5653b47563e4fea976d7c3ec635d81b
49841,vSphere 6 Data Center: Troubleshoot a vSphere Deployment,da520c5d617e4635bfdc92762458cfba
49882,Creating Visualizations Using Base R Graphics,e1060d2d86f24d159f05a208ec694ed1
49889,Critical and Analytical Thinking Skills in Data Literacy: Executive Briefing,0fb28c8c80f042878e7b93c419cf0aa4
49909,Tracking Real World Web Performance,05256ca6dcb440b5b7b9d8201075fa70
49915,Creating a Lab with VMware Workstation Pro,2e4d3f73bc7548c28cac7964eaa6450c
49984,Introduction to Virtualization,ce60cefbba6b4fb789233ba2b1e41e57
49985,VMware Server,4112d7bd08ad49e888ced9f1f83fbd2f
49986,Best of vSphere 4.1 for vNerds,a68d2f09fe7a456b9607ec9b020cb7af
50010,Play by Play: Demystifying Salesforce eCommerce,d1cbef6661a94f6e89e9d62e75910f3f
50165,Visio 2019 Essentials,f2dba7e08ee64e6bb0dd1c6d38456264
50168,AngularJS In-Depth,15082438de2645289fd7c1a0015dd401
50218,ng-conf '19: NgRx: A Reactive State of Mind - Day 2,45e8a033d317404a9d799708172a1f88
50240,Windows Server Administration Fundamentals Part 2,5604180762d2412b8445adf59c7f249a
50241,Windows Server Administration Fundamentals - Part 3,2adb14fcc24d487f9dfc897ac7a2aa31
50272,Consistent Design with Custom Lint Checks,887d9519106845ad831c492224119a9f
50347,Testing Clientside JavaScript,322e706b8107424caa157b9caf6ef778
50353,Configuring a Cisco Router for Cisco CCNA 200-125/100-105,414e7294d92343c1acd33927096e441d
50374,Writing Custom Scripts for OWASP Zed Attack Proxy,9a93935e69b74be5b05f5c9cbb15776c
50399,Taking DevOps to the Next Level with GitHub and Azure DevOps: DEVintersection 2019,e1120537901f4c84a1b3b9fb4cf718fd
50470,Architecting Applications for the Real World in .NET,fda1afb7a2334b97a1e6bdcf46678450
50471,7 Guaranteed Ways to Fail with Microservices,3381f1f6a456439c87752b81904c4e18
50476,Animate CC Dynamic Anime Action,f2507bf251084f239f4f10a80e2ed5a8
50478,Cellular Death Animation Using RealFlow and Cinema 4D,7e2d4ee3727e442cb3f6a9ef65eb1c32
50499,Troubleshooting with Cisco Collaboration Support Tools and Call Control Discovery,9a23ae0812434729828fbf0cf499d8e3
50504,Building Data Visualizations Using Matplotlib,180f2f393b1345de8364dad804a75f15
50521,Delivering Value Quickly with ICAgile,1f78bd42b962474a8cb8b78b0ae84e7a
50526,RStudio:Get Started,46a685923a4c45029a86a4512c7d7c61
50528,Finding Relationships in Data with R,8d5d2dd8d0b240a384e25bdc2fc02034
50534,SQL Server Performance: Indexing Basics,45b078cac1844bb38058c4ef5485815a
50553,Event Tracing for Windows (ETW) in .NET,3cce329da9c14fc4bfda906d0a541f24
50554,Maintaining and Monitoring Windows Server 2016,aa74f22b85b941c7b028ae07048144d7
50555,Building PowerShell Security Tools in a Windows Environment,b3b71db1098b4abdb036c36fcb8c9e1b
50567,Getting Started with HBase: The Hadoop Database,0c2fd9a7acf64d199b6399c3bde7f7f8
50622,Getting Started with Camtasia 8,a82b92be00534e5792f4b63391ed69e5
50623,Working with Geolocation in HTML,56700441005741c2a8c7311854387eca
50625,Creating a Wood Frame Model in Revit,34f9cc67ea5944f98af387152e02f45b
50758,Implementing and Performing Vulnerability Management,0483fcfb76a6477e8f7d28b5ba7610d1
50770,Managing Big Data with AWS Storage Options,14ee9c0d29fe48a0aee081a172b6dfa1
50854,Build Cross Platform React Native Apps with Exponent and Redux,f7fe1216dd334f6bb1ac758fff6cd3f8
50862,Putting Windows PowerShell to Work,6c80622ee53f4034977ddb74875feb4a
50872,Architecting Data Warehousing Solutions Using Google BigQuery,1dfba82d95ac48f4adc5b537f5ef0eef
50900,Enterprise WAN Network Design for Cisco CCDP ARCH (300-320),1e77c333ec07461aa57acd087b754c4b
50912,Troubleshooting Cisco Collaboration Multisite Calling Issues,a23865ecd3e04025b46c48fecad9adc8
51021,Implementing Docker for Windows Containers in Windows Server 2019,4345704ffef9407f9bab6e55fc4c826c
51050,Firebase Fundamentals,e51b0bdc494f4578a29d1f1c5d0fd868
51073,Advanced Reusable Styles and Themes in WPF,2a075134b87344b89ab51de06e5e8982
51114,vSphere 6 Data Center: Configure Availability Solutions,66a26ef11d36460a94712632a8b7d985
51115,Evaluating Your vSphere Environment for Best Practices and Security,cf8b8cbc1ec7440995fbcea1e216e08d
51184,Continuous Delivery and DevOps with Azure DevOps: Release Pipelines,7bcfab848a7d4bd98f7e910ca070ee7f
51186,Azure DevOps: From Source Code to Production,b41afdc726a5480681a069434a826aac
51201,Mercurial Fundamentals,a5d6e920cee544fc8a6405995d4498a7
51239,Cisco CCNP SWITCH: LAN Technologies,dca8ecf0ba51485db75f643f4e91624d
51244,Introduction to The .NET BackgroundWorker Component,89fbfdfb742946648acf33a008ee5488
51264,Windows Server 2012 R2 (70-412) Configure Active Directory,f59850674d5e4dad8fc2e6338878668c
51270,Truth About Data: Getting Started with Lean Six Sigma Analytics,da3c2677f7e64eceb0a8d942654f1612
51280,End-to-end Web Testing with TestCafe: Getting Started,f423c4de81424d36bc7d9c30da6fe8f3
51380,CommvaultÂ® Core Fundamentals,ba487d9bfc6547f0ad03bb0d5605cc08
51383,Implementing Active Directory Certificate Services in Windows Server 2016,ac76d8238d8e4ec0aaf6a31fca5712fc
51411,Design and Implement Storage on Microsoft Azure,bbd476ce01a245d897e12a1f622f4241
51412,Data Privacy Mythbusting,633dce356f9a41e090c761430a6d57f6
51424,PowerShell v3/v4 Essentials for IT Admins Part 1,2458efc23ca64cc0be054998e1618033
51433,CompTIA Project+: Part 2,ccf4d5a291b243ee9b3a46acf9aa9a5c
51442,Building Progressive Web Apps with Ionic,d7b7689e92f6418ca7c3046a5a1d8e0d
51466,The Value of Capturing Requirements,1bc570e2f73342178224ae5591e15590
51469,PM Methodologies: Executive Briefing,0a96fbe80c124fee8c65234895c57dd3
51477,Unity Fundamentals,77c44df257134979b66a166131c84345
51488,Illustrator CC Designing Type With Graphic Styles,a161d49097264af18628415a1a99a948
51516,Developing with .NET on Microsoft Azure - Getting Started,01463ec37fac4384a6e84e4a75e4f193
51558,Advanced Operations with Amazon Athena,ba5594d067f645b0919fd764bd1729b8
51574,Basic Administration of SharePoint 2016,e030e6c494ee47298a2828451d3aa505
51586,WordPress as a Network: Mastering WordPress Multisite,958eb7a1724a48cdb8b7ea3c4787c425
51666,Migrating Applications and Services to Azure with Visual Studio 2019,49d28d391611426d8052824476a27d7d
51678,"SCCM Current Branch: Install, Configure, and Maintain a Primary Site",c15ab0688893444c9afff41f229dba85
51684,Illustrator CC Building on the Fundamentals,8a19acd172444c2ca1e920dbbbe5e293
51699,IIS Administration Fundamentals,763b4943458244349f169202f6b4b7af
51739,Closing the Cybersecurity Talent Gap,efc9eda249f6497bb566bbfe7fb5de16
51743,Handling Fast Data with Apache Spark SQL and Streaming,71d339e24c9e40f4a11d874ff56c4a67
51755,Static Websites with Jekyll,7044dd6783734ae88b10c474b9f1ae2a
51779,The MVC Request Life Cycle,bbcb47ee1c144151aac13f529d1adc08
51780,"ASP.NET Web Forms Internals: Requests, ViewState & Page Lifecycle",90e68ca332df4088932ebdbde75866cb
51874,Solving Problems with Numerical Methods,44f94d366fc94af1b58c074bbde3c755
51891,Introduction to Sketch,b01b7ea18e68455ba9e658b032afb9c6
51897,On-premises Installation of SharePoint 2016,7886cc32a02f4d30872f7ce82baf30f2
51905,"Deep Dive: Conferences, Guides and Visual Studio Code Extension",113551b8912443e1914c6cbe2f1cb7f3
51998,droidcon NYC '19: Where the Heck Am I? Understanding Location in Your Application,a9a871e0a05444f68b1dff7f5cc608b5
52001,Working with Dates and Times in Python,47840fc428f24d1ca1ae1afce422d9b8
52026,Building Features from Nominal Data,d2a686da374f414da85e583114cd00b6
52091,"Quickly, Codelessly Connect Any Application to Any REST API",ae5c1b7e25d54e048ec7909a0e024a13
52119,What's New in Tableau 10,e48308bb3aac4210963e336f42adbe36
52131,Stateful Reactive Concurrent SPAs with SignalR and Akka.NET,ab542b0fa6cd4f1fbbe49cdef61f7551
52141,Linux: Managing File Services (LPIC-2),fa0adf25b1b1476f8dff9811c6e9e4d0
52150,Machine Learning with XGBoost Using scikit-learn in Python,35e6024692b941eb931e5edaac34eed8
52216,Deep Dive: Flow Proficiency Report and Mob/Pair programming,e417b9c5a0b0475caa72c4828837c9be
52265,Ethical Hacking: Enumeration,acd0ee7f84d64fefb1b70661f5800dac
52266,vSphere 6 Data Center: Upgrade a vSphere Deployment,aaf59cc5a89e46b6964188f1f36008ca
52299,Introduction to WireMock,ddc0b1b71e534959aa97133109b39d1b
52309,Modernizing Your Application with Containers,c5fe08e511dc400abd50782196b6c2d9
52320,Introduction to the Web,21d06eca9272477a8ff1f4709997eb10
52339,Connecting On-prem Resources to Your AWS Infrastructure,529abe37966b4fa39178d9f085899067
