,content,uuid
13801,Architecting Global Private Clouds with VPC Networks,73dae9caefb841f2b7bc1b85a4ca7d93
13829,Identity and Access Management for CompTIA Security+,8086ce34adfd4fce958038d84afd63c9
13861,Cisco CCNA Data Center: Intro to Data Center Networking,f78265dea1294f84a931a0b581d38db7
13871,Managing Microsoft Azure Role Based Access Control,add4001697cc41229668d5f66b61e269
13884,Understanding Enterprise-level Agile Implementation and Agile Frameworks,1ee958353ccb4e4688cb9c11eb1c5df0
13902,Security in the Cloud,66bf1c96d47548c1ad9aa3db28a372ec
13908,Securing AWS Infrastructure,58f8ef56cf594e039c4ed1644354b6af
13948,Force Layout Graphs in D3,a7cf0223e606430997da09017d518f3d
13970,Preparing for an ISACAÂ® Certification Examination,31b8867138864dd58cb7dc89c1bbc0c8
13991,Vertical Slice Architecture: CodeMash,e28967c73b514454943a514ba6ff57d4
14032,Yeoman Fundamentals,eb2411cd86c7427baba158ca98f7cca2
14035,"Perspectives from Responding to Other Outbreaks including SARS, Monkeypox, and Influenza",efa36e294b23448eab7ece5cc1433e92
14066,Marketing and Selling Your Own Products and Services,6f772a6dac164e6a80dfea835d4328fc
14070,PRINCE2Â® - Introducing the Value and Fundamentals,cc43f3dd377e4d42b574e59fe9de9340
14071,Combining PRINCE2Â® and Agile,8d533af6291e4dda97c43ec571f2f393
14091,Computer Fundamentals: Networking,ca4ef4f88ea3443d9426e601139e8579
14099,Ethical Hacking: Cryptography,97211cecfe8543e794bf4eca78c29d13
14124,Cisco IOS NAT for CCNP Security (300-206) SENSS,ece98152bf494570b2b35f64d6e51c46
14125,Designing Cisco Enterprise Networks: WAN for Enterprise Networks,1a868a212e1646ac94bdcd6140a162be
14131,Building a Consistent RESTful API with OData V4 in ASP.NET,539ff351c51b44c0aac5ba3c8e5f58bc
14161,Routing for CCNA Data Center (200-150/200-155),c17b5135dc2345568258b374d20cd7d8
14177,Gauging Project Team Performance,2d83cbb8bb194a6b8ed34dbc606e5b2f
14178,OS Analysis with RegRipper,e102a31042b148d3ac0d9a7677254a13
14180,Introduction to Unreal Engine 4,27000960c5b44d619c590ffd8bbe961c
14234,Security for Hackers and Developers: Code Auditing,75520336e955413481574604f2447601
14249,Operationalizing Cyber Threat Intel: Pivoting & Hunting,1ec0db4e9c0342449d7e07a094d396b4
14250,Threat Intelligence: The Big Picture,9c2129fe294349829422db02e7587b16
14251,Beego: A Go Web Application Framework,5745e6a1c59d439eae314f84effe477c
14286,Salt: Getting Started,8567e9c666954fa682f66d6e7ec7d7ec
14306,Managing IT Services with ITILÂ®: Executive Briefing,fd5dd97179bc42f98b0c76cc37758301
14337,Unit Testing with Node.js,5dd32692f57646b981fccf64d735b4f6
14351,Microsoft Azure DevOps Engineer: Implement and Manage Azure Pipelines Infrastructure,c5b3f210c7604883b870bbbee76f12ab
14374,Aspect Oriented Programming (AOP) using Spring AOP and AspectJ,f6c12162a3f64a558cadaa427bd64b32
14378,An AngularJS Playbook,28268dacca064a9bae1cd683762e56ba
14392,Architecting Event-driven Serverless Solutions Using Google Cloud Functions,e1d522ffe99c47b9b23efca86411ec9c
14411,ADO.NET Fundamentals in C#,fdf6380b060948e3b7109389fb6728e6
14434,Getting Started with GitHub Desktop,80d7e3683c0f4a0194197081f9ea2041
14440,Managing IT: Metrics and Measurements,746e0cc809fc457784f5023444856fb1
14456,Muse CC Responsive Design,2d6706ff15704cf683be52454584dea6
14484,Learning To Program - Being A Better Programmer,25925d50adf5471f9d583cbf10e2da9c
14491,Ethical Hacking: Penetration Testing,02d1726620a44b89a976ef1c025d4596
14497,Fusion 360 Essentials,009b948c62f745728197afac8507c394
14507,Building Dynamic Websites with PHP and MySQL,98ccc3bd30074688bd6be4648471e152
14510,Geospatial Mapping with D3,6db38c9c04c3489cab9bbc1904a6cc80
14513,What Building Architecture Can Teach Us About Software Architecture: CodeMash,601f86d086e1471095d6b54d5797218a
14524,Debugging Windows PowerShell in VS Code,e8c2cdea20354c89b9716fd7536d2b7e
14531,VMware Horizon 7: Create and Configure Pools,a3491033fdfd4c1bb530c4ad36aaa01b
14537,Confluence: Content Administration and Customization,9bdd49702c1c4586a7bf863431067271
14541,Building Server-side Rendered React Apps for Beginners,c30f9de0471e4e5988c90110935d5a4f
14569,Building Stream Processing Applications with Apache Kafka Using KSQL,7763b3a58906486d8d82b51e3c4952ea
14577,Introduction to Business Analysis & Needs Assessment,03787958117548148af555d0b073536a
14585,Getting Started with D3,85a630f7f95543ef9a66a1c5f6349a8c
14589,Python for Salesforce Developers,32f2eea276a74bcbaf1d68020e4fd793
14591,Pygal: Python Data Playbook,a5e421083a3f495c878a823a44b20a0a
14593,Don't Let Assumptions Kill Good Ideas,0c95b819dacb43aebb982b403f5f726e
14596,Red Team Tools for Emulated Adversary Techniques with MITRE ATT&CK,7b0040d9470b4a7f90bc2874eaca4df1
14597,Windows PowerShell and Regular Expressions,aff74c5b81fb428d9c6eacc750834713
14620,Getting Started with Polymer.js,718c0e712d8a4659a7931b516f7124ab
14621,HTML5 Web Component Fundamentals,44cdbd45ee574b8b95216efebc48ec94
14622,Working with Polymer.js Elements,3a7a97370bf347858540a566fdd03c94
14624,Getting Started with Hive for Relational Database Developers,6081153f91d44128a19c76febb2411ee
14626,Getting Started with Python Scripting in Maya,5d749d0a2c0a4f5dbdb52570b591495e
14631,Designing and Implementing Solutions Using Google Machine Learning APIs,0a0c6beff2cb418e8b77cd581cc325dd
14646,Achieving Basic Awareness of Information Security Measures (ISO/IEC 27002),4de230c6bf784fbe8640036d28acb5a6
14673,C# Design Patterns: Factory and Abstract Factory,692cf88d9b3d4ce19ed5cb210e6f5968
14690,JavaScript Security: Best Practices,b186ec8b83ed4ae49200377e1efd3bf3
14760,Play by Play: Becoming a More Effective Scrum Master,667164851a464dd5bf0ae84358e58bac
14784,Specification Pattern in C#,f71bca9de0c042a7a5a87cdafe3f765a
14787,Test-driven Development: CodeMash,0debee74d76043b293425a53656f4adc
14810,Getting Started with TeamCity,8292585b41e0401c87d9ce4344e714c4
14820,Implementing AWS Load Balancing,08512f44e1cd4c82b3f0af62adafafe2
14822,"Penetration Testing with Red, Blue, and Purple Teams: Executive Briefing",6b5abe53d8e04faf8cd9a39506430560
14831,iOS 11 Fundamentals,e52fecd254424b59a1c95751b19171f5
14834,Incident Detection and Investigation with QRadar Apps,4dab0fb5171647b7ae2575a485eb4a79
14837,Getting Started with Apache TinkerPop and Gremlin,c12b97d982ae42a2bfcb10e10041bdb1
14860,Modeling Requirements,46345aedfbcf448bb0cad2100dce6a66
14887,Ethics in Algorithms Panel,9791180fa58846729318244d1a68dfa7
14942,C# Design Patterns: Null Object,b7b0eab777f243aea822c454f51fb1b5
14943,Program Management: Governing Your Program,f63b499254ab4969859e8f433678aad1
14978,Patterns of Cloud Integration,9325f0766f4749b0a987afaaa62961bd
14995,Building a Cisco VCS Control Dial Plan and Expressway Remote Access Solution,4836fb18429442d584debe0c039dec32
15030,Securing React Apps with Auth0,6d8eff7418764df7a524b1fb71f32fa4
15060,Design a Networking Strategy for Microsoft Azure,f91f3532c2254a5e88f8c83cd67ad198
15102,Java SE: Building Your First JavaFX Application,35b0feefbcbd454d8d290b5882fe68d2
15108,Linux System Optimization,7cbf7bcbdf874c4388f811db209b6802
15128,Hands-on JavaScript Project: Solar Calculator,9f465b87b3624ca39a203e32e3a3aa28
15143,Vue.js Fundamentals,14bfb902c6714b899cafac556fb24468
15161,PostgreSQL Playbook for Developer DBAs,cfa1dd8d0ec341b0b6db828f20995cf4
15165,droidcon NYC '19: Effective Multiplatform Architecture,d34fcca54446494bb7f0f030d098a453
15191,C++ Fundamentals - Part 2,ce631d124cc94d97a951447f486f3f36
15210,Extracting Data from HTML with BeautifulSoup,c883be1ffa1c490a812f963217a4a09c
15239,Scrum Essentials Exam Prep,82dd3d6d2d7943acac5f70a84c3c95bf
15240,Creating New BigQuery Datasets and Visualizing Insights,4e2da5911e0644bfb8c082387b71a742
15250,Product Strategy Basics,63c341c3d7f541f1a8dbd1d7bb509b24
15262,D3: The Big Picture,4ce94cdf35a3477c807d4d1f06b0914a
15299,JavaScript Promises and Async Programming,1d1ed4b0e30c4d8889bb70aded4a20fa
15320,What's New in vSphere 6.5 and 6.7,21c993a74c234c07ad63de185bb3fbcf
15335,Azure IoT Hub for Developers: Getting Started,1d62c7abec304d3789d7f0316ce06685
15338,Practical Enterprise JMS Playbook,6e3cc0a646874a3da61da9d22637d8a6
15360,C# Design Patterns: Command,e6b2d8336c0c417c9c575b2ccb602f68
15363,Program Management: Planning Your Program,2600464b944c4b859a30311f7c0bbd4a
15388,Understanding Statistical Models and Mathematical Models,7f504ca0b18f4b9baab899668dc43aea
15389,Interpreting Data Using Descriptive Statistics with R,ac9d624c4e1f494589538f19e5bd6e34
15416,Supercharging Your GitHub Workflow,5f367f40f9ba45099971aa2f908d091a
15438,Social Engineering: Executive Briefing,be4ab0e534d64cd585a7c6c38a04b97e
15488,Security 2030: The Next Decade,59af57c93457464e9e9023e7ac835b68
15517,Cryptography Fundamentals for Developers and Security Professionals,5330ed0cbeae4f70b678e40e12a63d9d
15530,"JavaScript Objects, Prototypes, and Classes",ce408273b7514b4e8b9c1762f7069b1f
15532,Securing Applications on AWS,8d024ceefbc2402bbc9d061649fc3ce8
15553,Managing VMware vSphere with PowerCLI,29bd1fe14382484d8c4b58adc17c290a
15559,AngularJS with TypeScript,2b9938845b2f442496495dd40e09a3c4
15596,Program Management: Executing Your Program Successfully,1326f386418e47be988f067082316438
15602,Building a Website with React and ASP.NET Core,bddd039d0753463599427cbc685fe5ce
15628,Create and Manage Stacks with AWS CloudFormation Using the AWS Management Console,9a01d6ffc4864e5a80a9881550c64085
15650,VMware Horizon 7.10 ESB:  Introduction,7354ee9098b54a0ca474618fc56de9ee
15702,Ethical Hacking: System Hacking,ab7a195857054798b9b6e064adcb578c
15717,Introduction to Qt: A C++ Cross Platform Application Framework,42d82902ad6c4e5f98afdaeb028b9871
15817,Creating a Living Style Guide with Sass and Vanilla JavaScript,b817a000ddd542afbe89427060bddc23
15818,Adding Graphics to Web Pages Using Canvas and SVG,537febc632ac4a7285c7361098b06799
15819,Making a Responsive and Interactive Animation with SVGs in CSS,791b661c49ee4f16966055e3f1bea9d2
15840,XML Fundamentals,821f0db1a7a24aaf99134109d38a8cf7
15879,Security Awareness: Basic Concepts and Terminology,8a011aff11834f229a3f6191530214d0
15886,"Streams, Collectors, and Optionals for Data Processing in Java 8",703d1acd3bb44072a61413e515a04fae
15909,Designing for Virtual Reality,575d9ab9ab6e4ad1816352cf2086869f
15917,Business Analysis: Planning and Ensuring Success,edf5b199333e47ffae922e323e2ddfc3
15919,Android Apps with Kotlin: Custom Views,41612ec2d1544d97adc287ef402bbeea
15947,Getting Started with GitHub Actions,07f36867c1f348019b1f7911965a3de3
15965,Practicing CI/CD with AWS CodePipeline,eb34e7c4c8834ce1bf0851da124ddb66
15995,Working with JavaScript Modules,87746b76e26546e4a8740b1af8d51157
16001,Living in an IT Team as a Business Analyst,11d167c57c454233899f38ca05068445
16004,Meet Chef,0bb61c89f62f42278380dedf110357fc
16012,Getting Started Analyzing Malware Infections,ce13fc45e9d541629cf35d2524ef44a9
16024,Exploitation: Evading Detection and Bypassing Countermeasures,3d246cc2d9e1448b9b044fa4b4655406
16046,Azure Networking Basics,878b5439db0940a3991730380dc2c5a5
16047,Security Event Triage: Operationalizing Security Analysis,287c7b82d31542d680979b60a3be04cd
16066, Applying Special Effects to a Site Using CSS,8106ec3b23de427aab51adc826a57312
16067,Building UIs with the Web Animations API,51eec8cd3ac74e92a63cd71846be6993
16068,Becoming a Better Curator of Your Code: CodeMash,86781d41567e4126bd9dc3b95f2e74eb
16080,Secure Software Development,b7ac92b3ebba4f658989c51cd554f6e3
16110,Advanced Network Security on AWS,63d907b2c7214cbcb27d29b6caee6639
16148,Lean Software Development Fundamentals,a71021d7d010434e82b280ce0b98a6f5
16173,Networking for CompTIA Server+ (SK0-004),07014a0f409045f1bb11dcb7a20c1d27
16175,CentOS Enterprise Linux 7 Service Management,1a3b41ebb80b41a5bc1ce4e04bc4ee83
16178,"Deploy Azure Virtual Networks, VPNs, and Gateways",e3565b20ae994ac4a8fe5ea54d0d23c6
16189,Isomorphic React,cf92f0dc531a43b1b2c2dba51ca07101
16206,Designing Cisco Wireless Networks: High Availability,c0ec3be868db4519aab732d332f26c56
16214,Windows 10 Update 2004,2c66e2d14777434eb2c2f1c482cb7a25
16222,jQuery: Getting Started,51d83ac5976a4290a8064a235e29021d
16243,Public Speaking For Engineers: CodeMash,450944a7e0d84ba9bf0042d32c5e9587
16246,JavaScript Animation with GSAP,66967e559a194ebb97808411e1734594
16247,Level up Your Business Web App with SVG Animation,820eee9449c440f6882aa924d6e57fe7
16287,Career and Survival Strategies for Technologists,f80cad835c3444438d915991604d64d5
16295,Building Command Line Applications in Node.js,70176eb06a264d44a41f381d00103dc5
16339,Kanban Development With Jira Agile,8458e1cabbac460db6dd900de946f1f0
16341,Reading Legacy C++,b6de9190325b4c8281eef251fd513343
16350,Planner (2020),823c69dcaabd41a3b6468e9027552bca
16373,Implementing Multi-layer Neural Networks with TFLearn,ffcac244fcd34a62a7b89e58514ab21b
16383,C# Design Patterns: Strategy,ab78d994e0e34be78d6b1c645192754b
16414,How Can You Use Data to Monitor Your Lifestyle (From Food to Exercise) to Boost Your Bodyâ€™s Resilience Against Diseases?,460fc49f9e6f4a528de10e255f97f466
16415,Information Systems Operations: Monitoring,2188373b408f4936836a338fd5273efb
16418,Understanding and Applying Linear Regression,4bf17ee3893e4e69aaeb85fbf78e36d4
16423,IT Service Management General Practices,d42fe1501e294ead8338267ad9b0abbf
16424,IT Service Management Foundations,860672e300854a2d8e970bc5955ebd55
16431,Evaluating a Data Mining Model,dabaad07193d4c3ab32fe573e2d3e599
16448,LinkedIn Fundamentals,a37c34506f7943a2a047c8de7fa139d6
16501,Ethical Hacking: Cloud Computing,0ebc34da9fb74cbd965648e1b36ef6c2
16578,Building Layouts with the CSS Grid,59f33acb86064f29850def043bb9dab0
16582,Web Development with ExpressJS,395d13e9227f4fb6a56bd95def58b7f0
16604,droidcon NYC '19: Securely Take Payments in a React Native App,ee5b402b757c4b6581cb0206303f6f93
16668,Excel Time and Date Function Playbook,8d83ac05dc064432a92773a19ec1f5d0
16712,Designing Storage Networking for Cisco Data Center Infrastructure,a8ff1bb6d4714cd0aace64c1717938a9
16713,Configuring Network Storage Solutions with RHEL,5687ec6ca8b1493395f0b7e8b8786cf5
16737,Designing the Physical Cloud,7bb45732140049e29b967d9397c93afa
16777,Machine Learning for Business Professionals,510a03eed75f4f74a2b31163c02f392c
16782,Updating Stacks with AWS CloudFormation,e3d7b7f1d71049e48c22c136cd7ec53a
16815,"PMI-ACPÂ®: Agile Team Dynamics, Performance, and Leadership (7 of 11)",fad4e82e52a94e7fa537f9ec90d083dd
16816,Planning and Managing Enterprise-level Agile Transformations,908f3174f6be45b68dad9edc0ee68b0d
16857,Getting Started with Emmet,b1c7be33b8c249d7bf30f9e08eddb73d
16867,EMC Storage Essentials,0cda9a5367bf4350b18a2e85f791986a
16874,Leadership: Getting Started,c6325a7297384581b6d1e415530aab35
16888,Functional-Lite JavaScript,a1557ce7de40400a9d03e0a6bb20b500
16900,ng-conf '19: Amazing Backends for Angular Devs with NestJS,8ac2eb444fc0429f86a79366e951a54f
16914,Hands-on JavaScript Project: JSON,d4563315212d4ee697cf753e55bb528e
16919,Principles of Modern JavaScript: CodeMash,02344d418c534a7892d93673146ab532
16942,Getting Started with Spark 2,e61fa892510d4e21afee7ff7f9972b86
16949,The Hows and Whys of Podcasting in 2020: CodeMash,1abdf8d155e8435f9dde2ce883183f9f
16994,Building End-to-End Multi-Client Service Oriented Applications,71ed7001ff8d4b9eb93c14e764c57e0c
17025,Understanding and Using Essential Tools for Enterprise Linux 7,624f9e9b34d040f19dab1cac86f6b355
17054,Using Critical Observation on the Job,9fb5418bb8d0468697eb03f026258e33
17067,Operationalizing Cisco Firepower,6ed7f7e50b9a43b6932210780a9f94f5
17080,ITILÂ® Foundation: Core Concepts,9def7864647e4ce78d74a4e7e6e471ad
17088,"Building a Successful, Multi-Cloud Strategy",5d2ef2b6cb874b4e8c707fcb903932bd
17103,Querying Data from MongoDB,dd976752ce9a413d82c1695ce2c3ad53
17120,CSS 3 From Scratch,219200f02d5c4ff784ec213819ca4b9f
17165,VNX Block - Configuration and Operations,61aa6ba1a74240d8a4a147a63f61d90c
17167,Building a Pragmatic Unit Test Suite,889eaae685444d01bb7ba7f73a8b77be
17168,Writing Testable Code,65deb0f0b2494344bbe0508c074443e1
17173,Advanced Persistent Threats: The Big Picture,a0f04124f34e4166be0dc5c119fa728b
17193,Play by Play: Getting Started with Programming,5fb6848a03074b1e95776fc800f09002
17202,Seminar: Getting Started with a Career in Web Development,f382c7bf4e6e4a8b9436bbd40a3d7794
17204,Play by Play: Refactoring with Katrina Owen,1568d33de8814673ac5c8777a39b11da
17208,"Interview with John Papa, Developer Relations at Microsoft & Pluralsight Author",bc5bd14c888a425887be130f6df23f15
17216,Getting Started With Ubuntu,44d4e5d643604580b81d7c2bb99f0c4c
17248,Managing Windows 10 Devices and Data,cf08bc38b5f844198a49e79486e2b881
17250,Citrix NetScaler 10: Design and Deployment,5783da2f547f4516a0064aee5ad8346e
17263,How to Have Difficult Conversations,d0a13362e1b14d53a15521bcd782b29c
17270,Debugging Go Applications with Delve,3bb0f61c494f432fb49496452e3603ee
17365,Authentication and Authorization in Blazor Applications,e58de832fbb84af59432b34373c6da69
17367,Adobe XD CC Fundamentals,ed9b47937e3d4a8ab9372077c36faa5c
17411,Mastering Linux Storage Using LVM2,8ec315eeff8f423ca8eb147a36f0d086
17417,"Interview with Scott Hanselman, Programmer, Teacher, Speaker, Podcaster, Blogger & Open Source Program Manager at Microsoft",e6dd80287ffb48da99b5f126d3259237
17418,Introduction to GIS for Developers,b79481d27ee64a3b95514daadf6005ac
17423,ISE BYOD for CCNP Security (300-208) SISAS,721ec3f20709470aa2f5e31609ce53f3
17508,CSS Flexbox Fundamentals,62b376ac08984270b1c15b74faa52a18
17549,Discovering Microsoft Azure,73deeb5ad1a8487384a0dbb6bd5d13b4
17557,AWS CloudFormation Stacks and Automation: Best Practices,2e67a1f7bc01449f9d70c3c8f6eb8edf
17619,Writing and Marketing a Book,4cff5868212a422d95ddeff432f40e01
17640,Code School: Accelerating Through Angular,c0d35d97dfe245588605612e05a6aaa2
17642,Building Stronger Front-end Practices,2838dd229b0d492a9990c332db0e810a
17689,Code School: Blasting Off with Bootstrap,bd7a20679948418eb95916586c63ba09
17692,jQuery Forms and Bootstrap 3,1b97c4532bd14f36969d4460b774725c
17714,Implementing and Testing Blue-Green Deployments on AWS,c6ec54bdc6224f9f93ba62bf5e035c72
17784,GatsbyJS: Getting Started,62d4f9ead4ef41c8bed5ba3c63e2336d
17817,A Deep-dive into Conversational AI using Azure Bot Service and Cognitive Services,b9923f8938504e0a84cdd62c85ac4117
17833,Examining Cisco Video Conferencing Fundamentals,d8bb09b225824c2685ada90fd9981803
17875,Preparing Data for Feature Engineering and Machine Learning,4de5319b5c524bb4b31b74f3b370225e
17914,Preparing Data for Modeling with scikit-learn,e92c6e49adae424bb8ba8a15701d99f7
17915,Scaling scikit-learn Solutions,ff15b5002ef840e8b3df6444b8efafac
17916,Model Evaluation and Selection Using scikit-learn,54cf3e7fa4564c52aab6704986b46208
17920,Cisco Collaboration Core: Provisioning Endpoints and Implementing the Dial Plan,9e9d32d47c0147c9babf53197a7eec5e
17941,Getting Started in Podcasting,97ae3d4963fc49219968386e1e3191b2
17945,"Enterprise Security: Policies, Practices, and Procedures",a1742ed32b3742f7b2c65d52b71a6f35
17952,UX Strategy Fundamentals,132f5e9c4aa8472fb64cc87bf14ceffc
17959,Shifting JavaScript into High Gear with Web Workers,ddf6b12954bb447c87d1490ef0fa9f22
17974,Mining Data from Text,68d620cd5322453bac945488d3d73327
17975,Sequence Models for Time Series and Natural Language Processing on Google Cloud,96f4798bd74846cf8e948441df40be82
17979,Designing Appealing Cartoon Characters in Photoshop,096ff6206b1e4cafbf42beb708add7de
18002,"Understanding Ethical, Legal, and Security Issues in Data Science",64cc4403cb564e70a6abd792399df38b
18014,"Troubleshooting Cisco SIP Trunks, CUBEs, and URI Dial Plans",34240fafeead493685b148aef232ae76
18026,LFCE: Linux Service Management - HTTP Services,af1f9aa8881641eaa125af4ac1fd7f20
18029,Storybook: Getting Started,1ffe14f007594783af26b946235289b7
18030,Angular Denver '19: Make Your Component Tell You Stories with Storybook,982e3872191b4c9abb74f3e9c41c27ad
18039,Creating Responsive Pages with CSS FlexBox,bc8b6a16f67848f8acb464e2a6026006
18049,Advanced Git Tips and Tricks,8ba36741953046bd89bd1dcd151b2e2d
18102,High Availability and Disaster Recovery on AWS for DevOps Engineers,6a573f2957a94ce5b376a201d9887c81
18108,Network Layer Addressing and Operation for Cisco CCNA 200-125/100-105,32ab8295cf9f43adbeaef763b9355f35
18110,Reducing Dimensions in Data with scikit-learn,21c1720c16cb400e88b8cad366b7fc17
18111,Employing Ensemble Methods with scikit-learn,b5ff0b0d780c4f30bb62ee5f8e151fd6
18115,Building Classification Models with scikit-learn,12dc5a284cf744f998ee094384eaa40f
18131,Meeting Web Accessibility Guidelines (Section 508/ WCAG 2.1),f5822abaf5264bb2bb123707efc7445e
18188,API Gateways and Microservices: CodeMash,3e8dc01b49764c679c1ba30fae193004
18199,Advanced Unit Testing,eb001596d85f49ed85369c9aa1090db2
18216,CentOS Enterprise Linux 7 Network Management,188466d7c40249e4a809256203f7d1e9
18264,iOS Data Persistence: The Big Picture,40a8757757d54b369ae5c8841fd0163b
18265,WPF MVVM in Depth,1b0b60712e214e448e2d77ac5190bf19
18318,Design Patterns in C++: Behavioral - Chain of Responsibility to Memento,cba3ae68c5734f3689c7fbe5b2c27e24
18319,Design Patterns in C++: Structural - FaÃ§ade to Proxy,55e9ee1d60e6449bb4745afaddcbbbb1
18337,What Is TDD and Why It Is Not Unit Testing: Executive Briefing,ee358c37aae14834b987743215b9e9de
18417,Boost Productivity Through Employee Happiness,7b237e861aba4238b56eb732921fe243
18430,Master the Art of Toning Black and White Photographs,c36dd8306faf4b6d8ba3ec2daddbb827
18444,"Planning, Deploying, and Configuring Splunk Enterprise Security",41feacd8d6454d1b9a890cc6d8629620
18448,Using Wireshark to Analyze and Troubleshoot Wi-Fi Networks,061f2830383e410b9e580b5ba37679d9
18460,Implementing and Performing Risk Management with ISO/IEC 27005,40b20dc8c8ec4b52be229fb32dbcf7e9
18462,"Windows 10 Internals - Threads, Memory and Security",a29730f2534c456cb7b9f7c6b9b3334a
18477,Software Engineering Essentials,17d87575022541a4964f3d29ef84a304
18484,Understanding Algorithms for Recommendation Systems,3bc8b64e87cb47fdb103e40a0d18b57f
18508,Architectural Patterns for Azure Stack Solutions,099831aae5e14b4c8ac009eeb3fc07fc
18517,Cinematic Design in Unity with Cinemachine and Timeline,a844ccc9e4dc4d2ba6cd5c6c4ae04dd8
18521,Introduction to Houdini Pyro FX,0d77962c94f748638ee61242fc537d8e
18548,Scala: Getting Started,aabb8d04a0734ae3a0ac5ec9645e7869
18614,Threat Modeling with the Microsoft Threat Modeling Tool,842e8797d7224d5abb86e6c26c088d0b
18615,Configuring Cisco Video Collaboration Endpoints,2e961ecab2e74cfd8ff76e0d10ae504f
18619,Google Firebase: The Big Picture,9468ec86bb02485db13d5f887466e7cc
18621,Firebase Functions: Fundamentals,29e7e85f57824d8fa5500c87a817086d
18625,Creating Virtual Team Communication Plan,b649e701c0d64d7dbabf1f5107541df2
18798,Configuring Governance and Compliance for Microsoft Teams and Microsoft 365 Groups,9553c9e69b8d45c0b235cf7fa01d2ab9
18814,"Building on HTML5: Optimizing for Data, Communication and Offline Apps",21abe7dfc9224e4bacb0e5617d8e3762
18822,Electron Fundamentals,ddc41e07631745dd97e5cfc8300f6fcc
18827,Incident Response & Threat Hunting Using Bro/Zeek Data,8c45085470154f3b96faef77f82dd2de
18869,Beginning Data Visualization with R,1717dee6f2a84201a709f806bedcb963
18945,Introduction to Threat Intelligence,9bfcbed7c0534d71980dd8947b49d3f1
19016,AngularJS Routing In-depth,9b6e6344c9b34a7a8b911f082fd89cc8
19038,Introduction to Machine Learning with ENCOG 3,6ac10033b7be444eb06af14ce821117c
19039,Building	Image Classification Solutions Using Keras and Transfer Learning,f340f7a6c0514416a305329d48d9a793
19056,IT Outsourcing - Dealing with Outsourcing Risks,6e8b430af393452497d5d5d067936e2c
19076,Campaign Influence and Reporting on the Marketing Metrics that Matter,0d3b83fd632543f49018c83001d56fd0
19093,Building a Cybersecurity Home Lab Environment,e8e429ef72a94c5d9b73e60fe96d3dcf
19103,Getting Started with .NET Core on Mac and Linux,3f0dc7f7030045988f431eb277a0f535
19106,Introduction to Regular Expression (Regex),472ccb1996a84ec28e7422b853bda29e
19107,AWS Cloud Development Kit: The Big Picture,6ac31fc9c1fd4122b7108f3db26ebedd
19145,Security Operations,b6eff10d45564925be5bd14d04c63ca8
19152,Windows PowerShell Toolmaking Fundamentals,1b2e725477294ed7a702addff6fdd265
19163,Firebase Authentication and Cloud Storage,bdb0cf2d45274606b0703fbb763999d4
19179,Security Event Triage: Statistical Baselining with SIEM Data Integration,e43d62c6183b45beacc033192c003ce0
19180,Security Event Triage: Leveraging Existing Security Device Alerts,54ce8dfbbb484ee5b491225a9c9e4b35
19181,Security Event Triage: Monitoring Assets and Topology,6ef0e210670041baa41ce0d4555e9e63
19225,Beyond Alt-text: Trends in Online Accessibility: CodeMash,8d1978dbbec549449fd12b06e0bcaa54
19232,Building Your First API with ASP.NET Core,f7b9fb0a510247f78bb84811f9230695
19239,Converting 3ds Max Models to Presentation Plans in AutoCAD,786597a5d5b24e558252b566f833aaab
19244,Windows Server 2008 Server Administrator (70-646): Part 2,11598a37b4054c098d7de98f6d624388
19246,A Comprehensive Introduction to Microsoft Project 2019,6d2943e971004618beb12a26ffcda292
19252,Windows Server 2012 R2 Certificate Services,fac6d314e55345b8825f137a56ae5e8a
19257,Spring Security: Authentication / Authorization - Building Effective Layers of Defense,a8a14fb3bd1d45b2923220aaebdde6b1
19289, ng-conf '19: Effective Automated Testing with Cypress.io,a67900eeaad64299be767ad26135173e
19316,Modern Web Layout with Flexbox and CSS Grid,88adafc7ad8145e88230bbf382fb5ed4
19318,"Hands-on Responsive Web Design 3: Columns, Flexbox, and Grids",022ba20eaa754e7887c3e2bf02435656
